{
  "version": 1,
  "retention": 3,
  "publisher": [
    {"call": "publish", "value": 5, "seq": 0, "invoked": 1, "returned": 2},
    {"call": "publish", "value": 6, "seq": 1, "invoked": 3, "returned": 4}
  ],
  "readers": [
    [
      {"call": "open", "from": "oldest", "cursor": 0, "invoked": 5, "returned": 6},
      {"call": "read", "outcome": "item", "seq": 0, "value": 5, "invoked": 7, "returned": 8},
      {"call": "read", "outcome": "item", "seq": 0, "value": 5, "invoked": 9, "returned": 10}
    ]
  ]
}
